{
  "eventId": "evt-20260510-0001",
  "tenantId": "tenant-demo",
  "partnerId": "acme-marketplace",
  "eventType": "OrderCreated",
  "schemaVersion": "v1",
  "occurredAt": "2026-05-10T09:15:00.000Z",
  "correlationId": "corr-20260510-0001",
  "payload": {
    "order_header": {
      "order_id": "ORD-123",
      "order_date": "2026-05-10",
      "status": "A",
      "currency": "TRY"
    },
    "customer": {
      "full_name": "  Ada Lovelace  ",
      "email": ""
    },
    "items": [
      {
        "item_id": "L1",
        "product_code": "P100",
        "qty": "2",
        "price": "100.00",
        "status": "ACTIVE",
        "created_at": "2026-05-10T09:16:00.000Z"
      },
      {
        "item_id": "L2",
        "product_code": "P200",
        "qty": "1",
        "price": "50.50",
        "status": "ACTIVE",
        "created_at": "2026-05-10T09:17:00.000Z"
      },
      {
        "item_id": "L3",
        "product_code": "P999",
        "qty": "5",
        "price": "1.00",
        "status": "CANCELLED",
        "created_at": "2026-05-10T09:18:00.000Z"
      }
    ]
  }
}
